{
  "$schema": "https://json-schema.org/draft/2020-12/schema",
  "type": "object",
  "required": [
    "_schema"
  ],
  "properties": {
    "_schema": {
      "readOnly": true,
      "type": "string",
      "pattern": "^[a-zA-Z0-9_-]+$",
      "example": "notification_template",
      "description": "URL-friendly identifier for the entity schema"
    },
    "_id": {
      "readOnly": true,
      "type": "string",
      "format": "uuid",
      "example": "3fa85f64-5717-4562-b3fc-2c963f66afa6",
      "description": "Unique identifier for the entity"
    },
    "_org": {
      "type": "string",
      "description": "Organization Id the entity belongs to",
      "readOnly": true,
      "example": "123"
    },
    "_title": {
      "readOnly": true,
      "type": "string",
      "nullable": true,
      "example": "Entity Title",
      "description": "Generated title for the entity based on schema title_template"
    },
    "_tags": {
      "type": "array",
      "nullable": true,
      "items": {
        "type": "string"
      },
      "example": [
        "family:label"
      ],
      "description": "Entity Labels"
    },
    "name": {
      "type": "string",
      "description": "Name: Internal template name. Example: 'New Message Received'"
    },
    "type": {
      "type": "string",
      "description": "Type: Notification type key. Example: 'email_received'"
    },
    "notification_title": {
      "type": "string",
      "description": "Notification Title: Notification title as Lexical editor JSON (supports variables)"
    },
    "message": {
      "type": "string",
      "description": "Message: Notification body as Lexical editor JSON (supports variables)"
    },
    "action_label": {
      "type": "string",
      "description": "Action Label: CTA button text (supports variables)"
    },
    "action_url": {
      "type": "string",
      "description": "Action URL: CTA button URL (supports variables)"
    },
    "portal_title": {
      "type": "string",
      "description": "Portal Title: Portal variant title shown in the end-customer portal, as Lexical editor JSON (supports variables). Falls back to notification_title when empty."
    },
    "portal_message": {
      "type": "string",
      "description": "Portal Message: Portal variant body shown in the end-customer portal, as Lexical editor JSON (supports variables). Falls back to message when empty."
    },
    "style": {
      "type": "string",
      "description": "Style: JSON string with style config"
    },
    "_files": {
      "$ref": "#/definitions/BaseRelation"
    },
    "_created_at": {
      "readOnly": true,
      "type": "string",
      "format": "date-time",
      "nullable": true,
      "description": "Timestamp of entity creation"
    },
    "_updated_at": {
      "readOnly": true,
      "type": "string",
      "format": "date-time",
      "nullable": true,
      "description": "Timestamp of entity last update"
    },
    "_owners": {
      "type": "array",
      "readOnly": true,
      "items": {
        "description": "The user / organization owning this entity.\n\nNote: Owner implicitly has access to the entity regardless of ACLs.\n",
        "type": "object",
        "properties": {
          "org_id": {
            "type": "string",
            "example": "123"
          },
          "user_id": {
            "type": "string",
            "example": "456"
          }
        },
        "required": [
          "org_id"
        ]
      }
    },
    "_acl": {
      "readOnly": true,
      "type": "object",
      "description": "Access control list (ACL) for an entity. Defines sharing access to external orgs or users.",
      "additionalProperties": true,
      "properties": {
        "view": {
          "type": "array",
          "items": {
            "type": "string",
            "example": "org:456"
          }
        },
        "edit": {
          "type": "array",
          "items": {
            "type": "string",
            "example": "org:456"
          }
        },
        "delete": {
          "type": "array",
          "items": {
            "type": "string",
            "example": "org:456"
          }
        }
      }
    },
    "_manifest": {
      "readOnly": true,
      "type": "array",
      "nullable": true,
      "description": "Blueprint ID used to create/update the entity",
      "items": {
        "type": "string"
      },
      "example": [
        "123e4567-e89b-12d3-a456-426614174000"
      ]
    }
  },
  "definitions": {
    "BaseUUID": {
      "type": "string",
      "format": "uuid",
      "example": "123e4567-e89b-12d3-a456-426614174000"
    },
    "BaseTags": {
      "type": "array",
      "nullable": true,
      "items": {
        "type": "string"
      },
      "example": [
        "example"
      ]
    },
    "BaseRelation": {
      "type": "object",
      "nullable": true,
      "description": "Relation to another entity",
      "properties": {
        "$relation": {
          "type": "array",
          "items": {
            "type": "object",
            "properties": {
              "entity_id": {
                "$ref": "#/definitions/BaseUUID"
              },
              "_tags": {
                "$ref": "#/definitions/BaseTags"
              }
            }
          }
        }
      }
    }
  }
}